{
  "title": "Hot-water tank past its service life",
  "applies_when": {
    "op": "or",
    "args": [
      {"op": "lt", "field": "water_heater_year", "value": 2006},
      {
        "op": "and",
        "args": [
          {"op": "not", "args": [{"op": "exists", "field": "water_heater_year"}]},
          {"op": "lt", "field": "building_year", "value": 2006}
        ]
      }
    ]
  },
  "severity": 3,
  "probability": 4,
  "service_life_years": 20,
  "check_interval_years": 5,
  "half_life_years": 10,
  "mitigation": {
    "action": "Plumber inspects the hot-water tank and the safety valve and replaces the tank when it is over 20 years old",
    "partner_category": "plumber"
  },
  "points": 60,
  "known_quirks": [
    "Steel tanks corrode from the inside and leak without warning at 20 to 25 years",
    "A dripping safety valve is normal; a wet floor under the tank is not",
    "Tanks in a cupboard without a drip tray cause the largest damage"
  ],
  "why_hint": "DRAFT: The hot-water tank is over 20 years old, or its age is unknown in a house built before 2006. Tanks of this age leak from internal corrosion.",
  "benefit_hint": "DRAFT: A new tank or a drip tray with a leak alarm stops a slow leak from soaking the floor structure.",
  "source": "Seed entry. Numbers are placeholders until Rasi's analysis arrives.",
  "on_done": {"field": "water_heater_year", "value": "confirmation_year"},
  "tests": {
    "match": [
      {"water_heater_year": 1999},
      {"building_year": 1985},
      {"building_year": 1985, "water_heater_year": "unknown"}
    ],
    "reject": [
      {"water_heater_year": 2018},
      {"building_year": 2012},
      {"building_year": 1985, "water_heater_year": 2010}
    ]
  }
}
